review_id,product_id,title,author,rating,content,timestamp,profile_id,is_verified,helpful_count,product_attributes
R2DYCMS5TB4LC1,B0CP7YLJ21,"5.0 out of 5 stars Exceptional sound, reasonable cost",David West,5,"I live fulltime in my rv at the moment with my much loved custom sound system in storage. Over the past 3 years I have tried literally a dozen+ speaker systems trying to max out my acoustics. These are the best by at least 50%! The highs and midst are clear at higher volumes. The only critique I have would be that the bass seems a tad light. It's fine for me but I think younger folk might find the ""thump"" lacking a little. For the money and considering the space that I have to work with I HIGHLY recommend a pair. I intend on adding them to my ""real"" sound system when I get settled again. Thumbs up!!","Reviewed in the United States August 23, 2024",AESN6B3TSPTOX3JSU3YURR5AIV6Q,True,2,Color: Gray
R2FK67G9YUSSMW,B0CP7YLJ21,5.0 out of 5 stars This is THE MacBook Speaker!,Wilbourg,5,"Sets up in seconds. Sound fills the room. Huge bass even without using the Bass Boost. Rich, full sweep for classical music ( I tested Bach’s Partitas, Beethoven’s late Quartets and the 5th’s 2nd Movement. Superb all. I put on Tupac’s “All Eyez On Me, disc 1 and let it play. Thrilling. I DID NOT EVEN USE BASS BOOST! The Doss is simply the only Big Boy speaker your MacBook will need to fill the apartment. For $140 it’s a steal!","Reviewed in the United States July 28, 2024",AFW273P2VYEC5S52HJBYGYRAUE4Q,True,1,Color: Black
RGY6PMS85XQJ6,B0CP7YLJ21,4.0 out of 5 stars Best bluetooth speaker!,T. Blake,4,I have had this speaker for a month now. What I like about the speaker is the sound and the look of the speaker. What I don't like and it's just my opinion is when the speaker is on there are no lights indicating it's on. Also when charging the speaker there are no lights indicating the speaker is charged. Other than that it's a great bluetooth speaker.,"Reviewed in the United States August 27, 2024",AHZMHVJYDHA4YMFYDO4WJTTATLAQ,True,1,Color: Gray
R355HOGI1SUU4O,B0CP7YLJ21,5.0 out of 5 stars Blue tooth easily picked up and connected by 2 phones. works easy and has pleasant sound.,B,5,Pros: Easy to connect. Battery life is to be seen. Cons: I would have liked a status bar in my phone of the battery status. Simple speakers can do this why not this one ??,"Reviewed in the United States August 11, 2024",AH2RZZXFW2UCUGCWTZMDYFMBFZUA,True,0,Color: Black
R3E8MBK1KJ7D5B,B0CP7YLJ21,5.0 out of 5 stars Very loud if you need it & sounds great.,Jason Raub,5,"I got one on sale & it's pretty nice for a bluetooth speaker.I suggest reading the user manual if you want to access a few unique options, two of which I've not seen on other bluetooth speakers personally, like the ability to turn off all sound prompts while still seeing with an led indicator when you change activate or deactivate an option or feature being one of them.One feature I've also not personally seen on other bluetooth speakers this one includes that's much appreciated, it gives you the ability to disconnect & reconnect to the last device used from the speaker, on top of that when you turn it off then back on it will only connect if you re-enable it from the speaker avoiding audio switching straight from the last device causing problems say if you're on a phone call or anything else you don't want openly broadcast on accident.Only negative thing I can say is it's way too easy to listen to audio at unsafe levels with any high power speakers, including this one, and that's no fault of the speaker it's just something to be aware of. I gave myself a pretty bad headache turning the volume full blast, so I'd suggest enjoying your audio at a safe level & distance because it sounds really good until you hurt your ears or head.This DOSS brand makes some really good smaller bluetooth speakers too if you don't need this much volume, because this thing could seriously make your neighbors angry ha.","Reviewed in the United States April 2, 2024",AH4QFGDUBRCCHURNY5S2Z62EOZXQ,True,10,Color: Gray
R38N2985B5PDLZ,B0CP7YLJ21,3.0 out of 5 stars Aesthetics 5 ⭐️ BUT Audio Quality 3⭐️,C. Brown,3,"Ordered for our great room. Aesthetically it was perfect. Unfortunately, the volume level was hugely disappointing and the sound quality was somewhat muffled. If your space is a 10x12 office, it may fill the room. In our space, at the highest volume conversations could easily occur. Sound is our priority so 3 stars from me.","Reviewed in the United States July 22, 2024",AEHTLE4MCHLIFNGZIZSVOPQR7XHA,True,1,Color: Gray
R3VC9UA75507O7,B0CP7YLJ21,5.0 out of 5 stars Doss is Boss,John H Newman,5,"True High Fidelity stereophonic listening experience. Separation and doppler effect are impressive. You can hear that freight train coming in the east, pass by, and then fade away in the west.Bass is superior.Bluetooth connectivity is a joy.Buy two for the best listening experience. They are worth it.Highly portable and versatile because they’re wireless.","Reviewed in the United States August 5, 2024",AGLJ67442OZDT7HHB7ZWKTF6XM2A,True,2,Color: Black
RRXKM3YKF30PC,B0CP7YLJ21,1.0 out of 5 stars Missing packaging.,Jennifer B. Carpenter,1,Product arrived without basic instructions and hardware (device cords) included in the box. Unable to listen to this radio or give a viable review of the product.,"Reviewed in the United States August 13, 2024",AHKYI766I6EWNHMVVCZALB4I7KHQ,True,0,Color: Gold
R1TAHNAF9F3V7W,B0CP7YLJ21,5.0 out of 5 stars Good bang for the buck,Trapshooter,5,"I use this for my phone. When I record myself playing my sax on my Samsung phone, I turn this device on and can get a really broad sound of what I played. It will fill a room up. It can be loud and clear.","Reviewed in the United States July 27, 2024",AFDV7I2FEB3IUIY7XNCZOK7QV7LQ,True,0,Color: Black
R11P03WXADNBLR,B0CP7YLJ21,5.0 out of 5 stars Easy Install easy setup.,Amazon Customer,5,It makes a great companion to my listening pleasure. I sing and play back on the speaker and it even makes me sound good. Amazing.,"Reviewed in the United States August 10, 2024",AFRL2DNQVWHABF3H5WRA55FNK4JQ,True,1,Color: Gray
RJQ3Q0EO1H199,B0CP7YLJ21,5.0 out of 5 stars Sounds better than the SoundBox XL.,Lanie J ❤️,5,"The SoundBox XL still sounds really good hasnt had a problem with it after about 2 years with it. Once I bought the Ultra speaker and used it for a while. I can definitely hear the difference between the two. The bass is full, the highs and mids are clear. Will be purchasing another Ultra and pair them together. Became my favorite speaker.","Reviewed in the United States July 12, 2024",AE74FUC4FXZ2D4HGAEKBVERVZCQQ,True,4,Color: Black
RLVWVULH8VJZ5,B0CP7YLJ21,5.0 out of 5 stars Loved it,Trasi,5,Loved it,"Reviewed in the United States August 14, 2024",AG4EZT6FRO3ZAQ2CU5L25ZVPSRRQ,True,0,Color: Black
R5SC7XGAPI6CE,B0CP7YLJ21,5.0 out of 5 stars Great for a counter top,Daniel J. Porter,5,"We needed a nice looking portable speaker at our Airbnb that people could easily figure out how to use.this totally fits the bill. Its really nice looking, sounds great and is not that expensive so we aren't worried if it gets ruined or taken","Reviewed in the United States July 2, 2024",AF2MU7LDK6U4UDN6LXO642Q5OEPA,True,2,Color: Gray
R1AKQR7K65ZCSJ,B0CP7YLJ21,5.0 out of 5 stars Great sound for price point,Jennifer,5,"Easy to charge, and use. Phone jumped on right away","Reviewed in the United States July 24, 2024",AHII3G3J4DGWKPVHDWUANOYZ6HLQ,True,0,Color: Gold
R1VUXJH01EFVLA,B0CP7YLJ21,4.0 out of 5 stars Audiophile Sound Quality,James,4,"If you are an audiophile you will love this little jewel. If you’re not, you may become one. This Doss is brilliant. The speaker has nice weight to it. Nice bass, mids and highs. This thing surprised the heck out of me","Reviewed in the United States April 25, 2024",AEG6VLVREQL2CAHLZ5TVEMOREDDA,True,8,Color: Gray
RHOTVL5NE79NJ,B0CP7YLJ21,4.0 out of 5 stars Moderate sound.,Joseph C,4,Not a high end speaker. Bulky and heavy. Sounds a bit muffled.,"Reviewed in the United States May 19, 2024",AEWWQRYIV3XHR6HRM6YALMVX6DPQ,True,2,Color: Black
R34YDX25HFDRP1,B0CP7YLJ21,5.0 out of 5 stars Great for Short-term Rental,Brian,5,"We bought this for a Short-term rental property. We wanted something that would be easy for guests to operate and also large enough so people wouldn't take it. We've had several smaller Bluetooth speakers walk off.This speaker looks nice, sounds good, and is easy to use. Perfect fit for our use case.","Reviewed in the United States May 14, 2024",AFRQCAIKUFJ7UDD4LEKRPH2HJHZQ,True,5,Color: Gray
R1WLYGHLVS1P3S,B0CP7YLJ21,5.0 out of 5 stars Fantastic sound quality,Miki,5,Very pretty! Fantastic sound quality. Best I’ve heard in a portable blue tooth.,"Reviewed in the United States June 22, 2024",AEFLC7PDYIQEJDHGQI5PQSY5ZSXQ,True,3,Color: Gold
R2754UU1ZA4C8D,B0CP7YLJ21,5.0 out of 5 stars Big sound,KEVIN M,5,Wanted to find a good whole house sound and this one fit just perfect for what was needed. Anyone 2nd guessing just buy it you wont regret. Was very easy to pair with bluetooth also.,"Reviewed in the United States May 6, 2024",AG6G2NIAWECIFFVADCU7ARQIXEMA,True,0,Color: Gray
R3PXLBWLLXCCN7,B0CP7YLJ21,3.0 out of 5 stars Sound is okay,JB,3,"The sound is just okay. There is only one woofer, so there is not a lot of boom. Try something with two or more larger woofers if you are looking for great sound.","Reviewed in the United States May 16, 2024",AGQU3ZSOFW5YBVNQZGFU7SZLFMOA,True,5,Color: Black
R1WRJFOJESAYZ8,B0CP7YLJ21,5.0 out of 5 stars Insane performance from such a little box TRY TWO!,ewigz,5,"If you like well rounded sound with ""plenty"" of bass (more if needed w/ boost) - this is it. I purchased two and they perform InSaNeLy together. I have been a musician for 38 years - together they sound comparable to Bose, etc... One is FUN - TWO IS THE WAY! The TWS is flawless. Best portable speakers I have ever owned.","Reviewed in the United States March 3, 2024",AE6DKHVZQK6UDIAZATVNWM3O7KRQ,True,7,Color: Black
R1VJK2XP67AHTP,B0CP7YLJ21,5.0 out of 5 stars Excellent Sound,eddieb,5,Very Solid Bluetooth Speaker,"Reviewed in the United States April 19, 2024",AFLC6Y7TEUY7GYNNXXSYMKQ5H44A,True,1,Color: Gray
R26QZCWZB8SWCI,B0CP7YLJ21,2.0 out of 5 stars Sounds good,Daddy,2,"As far as sounds it sounds pretty good, but unfortunately it does not do the on and off sound anymore and does not auto connect to Bluetooth anymore.","Reviewed in the United States May 28, 2024",AGVLRJGHILV7DPTWRF7BYU7ZNVNA,True,0,Color: Gray
R3J8ZU2EBZY0U8,B0CP7YLJ21,"1.0 out of 5 stars No tiene buen sonido, se desconecta",Rómulo Peña,1,"El producto tiene un buen aspecto y luce bien, El problema es que se desconecta de Bluetooth cada 20-30 minutos, aparte le falta calidad en los agudos .no lo recomiendo","Reviewed in the United States July 12, 2024",AGUHU4A544PEGFFIABXIEWBSJYFA,True,1,Color: Gray
RY70UWXXXEYXF,B0CP7YLJ21,1.0 out of 5 stars Absolutely no bang for the buck. Buyer beware.,Robert Karandjeff,1,"I had the XL and the Ultra, before I returned both of them. They each had issues-the XL with the battery and the Ultra with a simple feature when turned on.Why pay big bucks for either when both products are not ready for market?!","Reviewed in the United States June 17, 2024",AEVJC7JLQFSRLIOWYFOHDTH5DMYA,True,1,Color: Gray
RYW8YWEACR10E,B0CP7YLJ21,"1.0 out of 5 stars Snap, Crackle, Pop",Amazonian,1,"The sound quality is truly awful. Your songs will snap, crackle, pop, hiss, and squeak. They will be so garbled and distorted as to make you cringe with every note.","Reviewed in the United States May 12, 2024",AH45XSMJSQBSSNZXUPNKYVYD3CVQ,True,1,Color: Black
R27NSEA4YJAF9R,B0CP7YLJ21,4.0 out of 5 stars DOSS SoundBox Ultra Bluetooth Speaker,MC,4,"Here is a speaker that I like for a couple of reasons.1, is that it has this clean, retro look. You can place it anywhere and it sort of blends in, but yet still adds a little bit of style to any area, and 2, is this clean sound that it produces.I will emphasize that many companies are starting to use the word ""BASS"" in their products description, because they know that it attracts the attention of the buyer. Many time they will over state the products function by using words or phrases such as ""Powerful Bass"", ""Mega Bass"", ""Booming Bass"", or ""Extreme Bass"" and their product will fall short, or may produce muddy sounds and low clarity.In this case, I will say that this speaker has moderate bass, and you will get a nicer and fuller sound it you place it in a corner on an angle, to help with the sound response and bass reflection.It also produces a pretty clean sound. I like to enjoy music when I listen to it and the only way to do that is to have nice mids and very clear highs.“BASS SHOULD BE A COMPLIMENT TO YOUR MUSIC, NOT THE STAR OF IT”!This speaker has very nice sound and style, with a decent compliment of bass. I enjoy it on my weekend mornings, sort of as a calming vibe. The bass is not overpowering, and the songs I play can be heard at an enjoyable clarity. The 80 watts of power is enough to fill the room and allows you to turn it up a bit for others to enjoy with you.","Reviewed in the United States April 27, 2024",AFEGGRZ2KH5OZPE5ESYHC2Y4USTA,False,1,Color: Gray
R304D3EM1TTVF6,B0CP7YLJ21,"5.0 out of 5 stars Stylish, well-made bluetooth speaker",LMG,5,"I'm no speaker expert, but as an average layman, I find this speaker to be pretty darn good.-The bluetooth worked effortlessly with my iPhone-It's quite substantial (easy to carry but not lightweight junk) and looks and feels well made. It has a cool retro vibe.-It has multiple playback modes besides Bluetooth (USB-A, USB-C, Micro SD, Line In)-It seems to hold a charge for a long time, at least a day's worth of playback-Large button on the top for On/Off, Bluetooth setup, Volume control, Extra bass and few other functions that are listed in the small instruction manual that comes with it-Sound comes out from both the front and backside, so when I use it in my patio area, people sitting ""behind"" the speaker, still get some decent sound-The sound is quite good. I wouldn't expect this to be the highest quality, but it's a great sound for what it is. I'm using this speaker for our guest/office space and the outside patio area near our pool and it looks and sounds just fine. The extra Bass button is a cool feature because when using outdoors, I can minimize the potential disturbance to my neighbors. I try to always be respectful of my neighbors with the music I play outside occasionally.-I cannot comment on the price/value since I have no reference for what this kind of speaker would typically cost, but the quality of this speaker is highOverall, I am happy with this speaker and I recommend it.","Reviewed in the United States July 11, 2024",AEYBGLTDGAW43QHIHPG4EHURZ7BQ,False,2,Color: Gold
R11KEMQS5SGT92,B0CP7YLJ21,4.0 out of 5 stars Nice quality sound,Latrice,4,"This Bluetooth speaker has good quality sound. I use this speaker at home in my office,it's easy to setup and connect to Bluetooth. It also has a cool design and is a nice size speaker for a office it's very durable, I've had this speaker for 3 months and it's still sounds great .good deal for the price","Reviewed in the United States June 1, 2024",AFHEXCRC6LATU2TSK2VPTATCN63Q,False,0,Color: Gray
R3MIAOES1GMS8H,B0CP7YLJ21,4.0 out of 5 stars Good Nuanced Sound,imsureitsfine,4,"The media could not be loaded. Audio being such a subjective thing is sometimes hard to review. With that in mind, the thing that stuck out to me most when starting to use this speaker was the overall balance and nuance to the sound profile. I've spend my fair share of time with other speakers and I find that they often tend to tune their speakers as very bass heavy to make it feel like that they are more ""powerful"" than some others. The DOSS speaker, while perfectly capable of hitting some good lows, does a great creating an even soundscape and doesn't drown out everything in muddy bass. Out of the box, I find it to be very pleasant across a variety of music genres. There is aIt does get plenty loud, and will easily fill a modest sized room. I haven't specifically timed playtime but I have been able to make it through two days of work and a medium volume without charging. I'm using it primarily via the Bluetooth connection although there is a 3.5mm for direct connection.Construction wise, I think it feels good. Very hefty and not at all hollow feeling. The ""wood on the sides is nice enough visually but the right side of mine it slightly indented for some reason. You can feel it more than you can actually see it. I like the overall minimal look and the button dial up top is functional. To that point, I do wish the volume was more of an analogue dial you could rotate as the volume intervals aren't quite as precise as I would like. You can always use the slider on your device to achieve a more exact level but it would be nice to do this from the device. Also, there is skip or back button. You can pause and play with the larger center button.This also supports linking two units for better separation. I only have one though so I can't comment on how well that works. The BASS-M button seems to increase the low end a bit when you press and hold it. At lower volumes I think it is effective, but when it is louder, I don't think it is necessary.Although DOSS may not be the first speaker brand that comes to mind, I'm quite impressed with their approach to sound. I like the playtime, sound design, minimal look, and mostly good construction. I think their buttons could be better but are serviceable. Given the price (as of this review) of almost $180 I think it might be hard to justify compared to some others on the market. That said, if you listen to one of these, the sound performance might be good enough to make it worthwhile. I'm quite happy with it despite some minor flaws.","Reviewed in the United States March 17, 2024",AHNWO5R6A2P4GSRUPEDJMO3XSPRQ,False,6,Color: Gray
RNXZ88CE7BCZX,B0CP7YLJ21,4.0 out of 5 stars Decent sound but was hoping for more bass,ralfwolf,4,"For a speaker of this size and price, I was honestly hoping for bass. Don't get me wrong it sounds good but just doesn't really have a punch. It does play quite loud and overall sound quality is clear and definitely better than the smaller portable speakers I've tested. I found it interesting that this speaker came with a battery given the size. I would have rather given up the battery and given it a larger or extra bass driver or echo chamber to improve low end punch. Unfortunately, as is, it's in an awkward middle spot of ""too big to travel with"" and ""don't want to leave it plugged in because of battery"". I might take this guy outside for an backyard meal and that's about it because I've got other speakers that have good bass and require plug and smaller portable speakers that almost as good but much smaller and much more portable.","Reviewed in the United States April 9, 2024",AFXYUG75FJNUK43VD22FS366H46A,False,0,Color: Gold
R15AN8A3VP85XQ,B0CP7YLJ21,4.0 out of 5 stars Excellent sounding speaker,Gurtar Man,4,"This speaker is awesome sounding. It has a lot of high end clarity that other bluetooth speakers seem to lack. It also has great bass response. As far as pairing it is somewhat easy, it took a few tries to get it running a bluetooth transmitter from my tv.The instructions are included; however, they are printed very small and I cannot read them. So it has n=been all guess work. If I could read the instructions I might be able to figure out how to use it better.","Reviewed in the United States April 17, 2024",AH4WF4HU3JOUUVK2QBLGQ756INNQ,False,0,Color: Gold
R1SR77LKZYKF9I,B0CP7YLJ21,5.0 out of 5 stars Overall great-sounding speaker,Kaz,5,"This speaker was hard to review as it's different from most Bluetooth speakers I've used. The midrange is great, the highs aren't piercingly annoying, and the bass is good for its size.Notes:-All testing using audio being sent via Bluetooth from a Samsung Galaxy S24 Ultra using Tidal on the highest settings for all tracks.-Best overall sound quality tests were performed at 2/3 volume level via Bluetooth.-This speaker's ""perceived"" sound quality seems to be *very* dependent on the music being played back.Positives:-Loud. More than enough power to fill a large bedroom, living room, etc. You can feel it moving air.-The midrange and highs are really nice and clear, even at higher levels, without being obnoxious like on pretty much every other spearer of this size I've tried.-It handles classical music extremely well, as long as it doesn't dip into the lows very far.-An absolutely fantastic solution for limited space when in need of better sound than what you TV can output.-Connecting via Bluetooth is super easy with everything from Windows, iOS, and Android, I had zero issues.-USB-A port for thumb drives-USB-C rechargeable-Micro SD card slot.-Line in.-Metal speaker mounts.-Single-piece metal front/top/back, good looking wood-grain effect plastic sides.-Simple top buttons are easy to use to control the speaker.-Supports dual-speaker playback, allowing 2 to be paired to the same audio source.Music Tests:-Whilst this speaker does have more bass than similar-sized speakers I have tried, it's nowhere near ""deep"" per the listing.-It cannot, in any way, handle a track like Daft Punk's ""Musique"", the changing/sweeping bass/mid parts in the track, it just gets lost 100% and makes it sound like pure trash at anything but low volume.-Contrasting that, it handles Daft Punk's ""Around the World"" acceptably at about 2/3 volume without running into distortion.-X Ambassador's ""Hold You Down"" loses its very impactful bass, unfortunately, but otherwise still sounds good.-Whilst it doesn't have the hard-hitting bass that's possible, Earth, Wind & Fire's ""Let's Grove"" is reproduced respectfully.-It handles Lindsey Stirling's ""First Light"" and ""Eye of the Untold Her"" extremely well, even cranked up, without distorting. Whilst the bass isn't ""there"" as it would be if these tracks were being pumped through a stereo with large speakers, or even a high-end pair of headphones, the fact is can still sound good playing these tracks is impressive.-Claire de Lune sounds great cranked up about 2/3 of the way, handling the nuances of the piano fine. Anyone else think certain music in the Zelda series of video games reminds you of Claire de Lune, or is that just me??-Cream's ""Sunshine of Your Love"" sounds great, even able to make out the stereo separation of the track extremely well, which is surprising for something this small.Other Audio Tests:-Makes TV shows and YouTube audio sound fantastic as it handles voice extremely well.-As long as you're not playing a game with massive explosions, video games are reproduced great.Considerations:-To get more bass out of the speaker and to project the sound more, place the back close to a solid object/wall or to make it even better, put it in a corner. Doing so can have drastic improvements on the sound.Negatives:-As mentioned above, this speaker can sound amazing, and then like trash, depending on the music it's playing. The best example being the contrast between Daft Punk tracks. The sub just starts rumbling at higher volume, unfortunately.Overall:-I find listening to this speaker to be very pleasant over long periods of time, even at high volume.-This DOSS speaker handles the midrange up highs far, far better than every other Bluetooth speaker I've tested in the sub-$150 range.-Don't get this if you're looking for bass, you *will* be disappointed. At high volumes, the bass goes into muddiness zone or it kinda just stops putting anything out.In Closing:-For the normal 'list price' of $179.99, there are better options available. If you can pick this up for the current $129.99 with the $10 coupon, bringing it down to $119.99, I'd highly recommend it.This review is for ""DOSS SoundBox Ultra Bluetooth Speaker with 2.1 Sound Channel Audio, 80W Superior Sound with Deep Bass, Two DSP Technologies, 18H Playtime, Bluetooth 5.3, Wireless Speaker for Home, Office, Livingroom""","Reviewed in the United States May 5, 2024",AE7RH2BM22UZAZTXSJUF2ZGXSKSA,False,2,Color: Gray
R3VVHW6HWNU6BP,B0CP7YLJ21,4.0 out of 5 stars Great,Nong,4,"This thing is nice. It feels and looks premium and the audio quality is pretty darn good for a small-ish portable speaker. It's not the most clear audio - a bit on the tinny side, but overall is good. There's a good amount of bass and it sounds much better when turned up louder.It's a bit pricey for the overall quality, but it does feel high-end. It would just be better if the audio quality matched the price more, but for the compact size it does well.","Reviewed in the United States April 11, 2024",AE32QKW66LICYFSFSZJJUMRI3TDA,False,0,Color: Gray
RH2Z5GYTGCKIA,B0CP7YLJ21,5.0 out of 5 stars Great looking speaker with Great Sound,Sleewok,5,"I have been using this speaker for over a month now and I really like it. It is heavy and that usually means quality. In this case that is true. The battery life is excellent. I have only had to charge it once in the last month. The visual style of the speaker is very nice. It looks great on our bookshelf.Pairing is fast and easy. I tested this with Apple and Android phones, FireTV, and a projector.The sound is crisp and clear without distortion. The bass feature gives a richness and fills out the sound.This speaker is on the pricier side, but I think that the quality meets the price.My only complaint is that I would like if it were louder. We set it up for a movie night outside and even at full volume on the FireTV it was a little too quiet.","Reviewed in the United States June 8, 2024",AHB6C47J6MKSE24KNT4BKXL2PV2Q,False,0,Color: Gray
