review_id,product_id,title,author,rating,content,timestamp,profile_id,is_verified,helpful_count,product_attributes
R63IGI3L9RC0N,B0CP7YLJ21,5.0 out of 5 stars Good looking speaker,Cari,5,"Very easy to connect and control. Powerful with clear sound. It feels good to turn it on and use it, with the added bonus of looking good, and the battery lasts forever. Quality matches the price.","Reviewed in the United States April 7, 2024",AHZM5USEXAP5AQA7SASN72T7LYEA,False,0,Color: Gold
R1S1PLQCOTZA0A,B0CP7YLJ21,5.0 out of 5 stars Powerful speaker,The Avid Aviator,5,"This speaker is actually impressive. The volume range is great, and it has impressive bass for its size. It's got a good home asthetic, but honestly I've already taken it to the beach. It'll be versatile for parties and jams or just sitting at home watching a movie.","Reviewed in the United States March 19, 2024",AG45KKKEFH2XBIWE34YXJESQXITA,False,0,Color: Gray
R2T7TCV2HWR1SM,B0CP7YLJ21,3.0 out of 5 stars A decent speaker that is well behind its competition,Tyler,3,"Doss has been around a long time and I've tried a few of their speakers over the years. They had some highly rated products 6-7 years ago but they haven't kept up with the competition. This is nice looking speaker with a nice metal grill and fake wood grain sides. While it does run on battery it makes no pretension to being any type of outdoor speaker, It has no IPX rating and is not rubberized in any way. This is strictly a speaker meant for around the house, in a dorm room or maybe using a deck. As for sound it is acceptable, but not amazing. It is loud but lacks high end sparkle and bass is a bit muddy especially in bass boost mode. It has no app or eq beyond bass boost on or off.The big problem with this speaker is its 180 dollar price tag, Though it is currently is 50 dollars off, at that price there are just far better options. If you want a great looking speaker that sounds better than this around that 130 dollar price the Soundcore X500 and X600 both blue this thing away. Doss is trying to sell a speaker worth 50-80 dollar speaker for $130-180. Just an extremely poor value.","Reviewed in the United States March 7, 2024",AFQC76G7KO5TTAWJOIAREAKEJP5A,False,0,Color: Gray
R21HK43Q7VBMVA,B0CP7YLJ21,5.0 out of 5 stars Awesome,Donald J.,5,This bluetooth speaker is loud. I'm amazed on the quality of sound as well as what comes out of this small box. It works great and I have no complaints. It has an micro SD port as well as a USB port and charging C-port. So you have multiple ways of playing music if your device isn't bluetooth that you want your music from. The color is a pretty silver rose gold color and looks nice on my shelf. Good product great sound!,"Reviewed in the United States March 17, 2024",AHQDVHHZV45V6RZ5NKQGVEAMB42Q,False,0,Color: Gold
R2TKVANT5WMWBM,B0CP7YLJ21,5.0 out of 5 stars Powerful speaker,Sissi,5,DOSS SoundBox Ultra Bluetooth Speaker with 2.1 Sound Channel is awesome..the sound quality is amazing( and can be very loud)with some bass to it..it looks slick and well made..the quality is superior to the ones I had before.. it's very easy to connect it to WiFi and it charges very fast.. it held on it own for over ten hours when we used it at the park for a get-together.. It's a little on the pricey side but it's a great product..will recommend it,"Reviewed in the United States March 10, 2024",AHAP3PXCWSYKYDZDYYKGRF6YQBWA,False,0,Color: Black
R22E7F2QKRAEOE,B0CP7YLJ21,5.0 out of 5 stars I'm really enjoying this thing,Eric M.,5,"It sounds great, it doesn't look out of place wherever I put it, and the battery seems to last quite a while","Reviewed in the United States March 21, 2024",AHH3C7C4VOTHALNQHX3TLG35ZVLQ,False,0,Color: Gold
R5315Y1T6JYVZ,B0CP7YLJ21,5.0 out of 5 stars Big sound!,Schmedved,5,"This is a hefty, sizeable bluetooth speaker. It was mostly charged, but was topped off in 30 minutes with the provided USB C cable. The sound is crisp and clear, and it stays clear all the way to full volume. The bass is ok, but not big. I'm very satisfied with this speaker. It has a micro SD cardbslot in the back to load music. It doesn't really look like an outside speaker, more of an around-the-house speaker.","Reviewed in the United States March 14, 2024",AH6MRQRZP5CCX44W7TPCQGUFQQZQ,False,0,Color: Gold
R3D59Y4FNIVF52,B0CP7YLJ21,5.0 out of 5 stars Excellent Quality,Kochman,5,"I am using this Bluetooth speaker to provide sound for my smart TV and it is amazing. I keep it plugged in all the time but the great thing is I can move it to anywhere I wish. No more expensive wall mounted systems. The quality of the sound is great, with good base and precise speech tone. The design is also very classy and compliments my decor.Highly Recommended.","Reviewed in the United States March 11, 2024",AGWYWA2QKXCRSEHD2CAYARD3HGYQ,False,0,Color: Gray
R3OYOLIQL3RK9J,B0CP7YLJ21,5.0 out of 5 stars Sound quality is amazing,PAGE,5,"This Bluetooth speaker has phenomenal sound quality. It is very easy to pair it with my devices. It supports Apple and android devices, which makes it very convenient. Easy to control the volume and other controls. Very sleek and modern looking and comes in a beautiful gold color.","Reviewed in the United States March 19, 2024",AG7LDCGYC472WU54TMOZICIEVUNA,False,0,Color: Gold
R235XOT7UUKPLP,B0CP7YLJ21,"5.0 out of 5 stars excellent audio quality, but at a price",Alfred S.,5,"This speaker delivers superior sound, at least to the untrained ears of a mere mortal like me who is not an audio-speaker geek. The bass is rich. The audio is clear. The volume can get quite loud without distortion. It is easy to operate. It functions for well over twelve hours on a full charge. It is so sleek that it is almost invisible on my book shelf. I cannot image a one-piece 13.3"" x 6"" x 4"" indoor speaker sounding better than this one.But it is very expensive. At this price, other products may be preferable, like two- and three-piece speakers that create a true stereo sound.","Reviewed in the United States March 5, 2024",AETDFDC6KFZLAJNXPVWJ5XMFMB5A,False,0,Color: Black
R1MQ8CQHL6QQ2W,B0CP7YLJ21,"3.0 out of 5 stars Oh you beautiful, flawed speaker",Khoi Nguyen,3,"It's a beautiful speaker for those who enjoy the retro aesthetic.But for the steep price of $160, the audio quality on these speakers are 6/10 at best - the bass comes across weak and muddled, the mids and highs are okay, but the volume is very loud! Normally this would make it a 4/5, despite the price, but where I have a problem with is the control itself. I don't care that the buttons are flush, but knobs really would've made this work better, because it's hard to tell what the settings are, as there are no app controls or screen to indicate data.Secondly, the aux port is messed up. I was going crazy trying to get it to work, swapping in multiple aux cables only to find that the device only recognizes the aux setting when it's plugged in 3/4 of the way...and at that point the sound is unrecognizable. Maybe I just got a dud? Either way, poor quality control for a device of this price.Now, if you're only concerned with bluetooth and the aesthetics, then I'd give it a 4.25/5....but overall it's a 3 for me.","Reviewed in the United States March 15, 2024",AFIMYNSWISMQZ23GA74OL623HCUQ,False,0,Color: Gold
R19BWMYUS85XZI,B0CP7YLJ21,5.0 out of 5 stars LOUD,^_^,5,"I took this out of the box and was slightly suspicious that this wouldn't sound any better than my usual speaker. Um, wow. This thing is LOUD. It's surprising how loud and clear it sounds for being as small as it is. This actually out-performs my soundbar. You can easily hear this through my whole house with no issues at half volume. If I cranked it up all the way, I'm sure my neighbors could clearly hear it, too.The battery life seems good so far, which is beyond bizarre to me, considering how good the sound quality is. However, with that being said, it is a bit on the pricey side. In my opinion, it's completely worth the money, though.","Reviewed in the United States March 1, 2024",AH557O5Y2DOA5D5DOTVWP4VUPRNQ,False,0,Color: Gold
R39XRID54SYX68,B0CP7YLJ21,5.0 out of 5 stars Great Addition,Brother EDEN Douglas,5,This speaker adds a layer of sound to my desktop speaker setup. It is easily installed via a USB port and makes a noticeable improvement. Very handsome design and Bluetooth enabled as well.,"Reviewed in the United States March 18, 2024",AE2HKAWTY554R3MS4ZJNJKAGCI5Q,False,0,Color: Gold
R1EL4KXEALHXSF,B0CP7YLJ21,5.0 out of 5 stars Almost too much bass! Adios to tinny speakers,James A. Woolsey,5,"For years I've put up with smaller tinny speakers for my laptop. Early units from years ago had a separate bass box and a tangle of cords. No more; simple Bluetooth hookup.My 79 year old ears have lived through too many rock concerts and I need a mid-range boost. So when I plugged this unit in, the bass was fantastic revelation to hear (and feel) once again...but too much bottom is muddy ...for me. Young ears will love this.I adjusted with the EQ to lower bass a bit, boost the voice bands, and WOW! Now the old feeling was back!This unit has some weight to it, not plasticy feel. For a small space the DOSS delivers!","Reviewed in the United States February 27, 2024",AF55IJVLAAWZYBQJ4TZXW2XYVDIQ,False,2,Color: Gold
R2OH6CED8ZMLQ9,B0CP7YLJ21,5.0 out of 5 stars These are really nice.,Denise,5,"This is my second one of these speakers and I absolutely love them! Sound profile is very nice. Very balanced between mids, highs and bass. Has a bass boost function that works well (I am not a bass boost listener but I like this one). The build quality is superb and well constructed. I really like the retro kind of look. Charging was fast via USB-C and battery life is sufficient. I like this product from Doss.","Reviewed in the United States March 1, 2024",AEO3COEYZSG44DHOKFQVYDLQMGNQ,False,0,Color: Gold
R3HBXB4VZ94I99,B0CP7YLJ21,5.0 out of 5 stars DOSS SoundBox Ultra Bluetooth Speaker,William's Syndrome Mama,5,"Oh wow! This is the second DOSS SoundBox speaker I've owned and man did they ever up their game!! This speaker is legit. It's got everything you'd expect in a high end speaker with regards to connectivity and options. I'm not technologically advanced myself, but I was able to easily connect it to both my cellphone and my turntable so I'm super happy! It's heavy and bigger than I thought it would be, takes up a bit of space on my TV console, but it's better than my sound bar as far as the sound quality goes. I might just hook my TV up to it instead! Highly recommend this sweet little speaker. Worth the price for the step up in quality. Would buy again.","Reviewed in the United States March 7, 2024",AEGN2MYMB4PYHITFDOLXAO32MHIA,False,0,Color: Gray
R4H13ENS3BA78,B0CP7YLJ21,5.0 out of 5 stars Nice!,Blessing Family,5,Just got this speaker and wow the sound is incredible. And it does get really loud without distortion. Was easy to pair up with my phone. My only gripe would be that it could use a handle to carry outside onto the patio during cookouts. The price is a bit salty but for such a great sounding speaker it just may be worth the price.,"Reviewed in the United States March 4, 2024",AEJHQT5WDYHC5XHBPILQ2X7JKRQA,False,0,Color: Black
RMAYAKTO9F0R2,B0CP7YLJ21,3.0 out of 5 stars ok,TomNVan,3,"paid way too much, primary complaint, should be somewhere near $70, but if a sub $100 speaker is what you want, this will work","Reviewed in the United States March 5, 2024",AGY25HKRV2H7DILSOKUPF33I5NRA,False,0,Color: Gold
R35MPTHKZXVLVE,B0CP7YLJ21,5.0 out of 5 stars Works great,Shelly Magner,5,"Perfect for home, office or entertaining. Large and powerful sound with many features. User friendly and easy to set up via Bluetooth to play music from your phone. I have it set up in my office and can easily control the sound volume with my phone side volume buttons without having to go to the speaker","Reviewed in the United States March 7, 2024",AHL3UJHQJ25GBQPTMASKLWNIH2KQ,False,0,Color: Gold
R1MRSK7GB82ZEI,B0CP7YLJ21,5.0 out of 5 stars Big sound for small box,David Reiter,5,"Easy and fast install wireless to my TV, great sound, noticeable improvement for TV, well packaged, seems of high quality","Reviewed in the United States March 7, 2024",AHYYJIPRQ4EMF4KA5R4D6C7PJSLA,False,0,Color: Black
R2YER5RV04CZ74,B0CP7YLJ21,5.0 out of 5 stars I want to give this TEN STARS,Howard Abraham,5,"The media could not be loaded. I had no idea anybody was making Bluetooth speakers of this quality. It sounds so good you will want to rediscover your music collection. Sure, with 80W you can make it loud, but the speakers and enclosure work together to fill the room with music in a way that nearly sounds 3D. They say the speaker will last for 18 hours at half volume. Even at half volume this speaker provides and incredible experience. You don't need to bludgeon your ears with noise. This is a speaker you want to closely listen to so you don't miss any detail. Simply beautiful! Highly HIGHLY RECOMMENDED!","Reviewed in the United States March 15, 2024",AF7AXIIL5CI7A6OLJMMNMCTJCDTA,False,15,Color: Gray
RBPITYT3BLGJD,B0CP7YLJ21,5.0 out of 5 stars Rich Sound,Tone,5,"The media could not be loaded. This soundbox ultra can cover an entire room with its sound. Now if you're looking for loudness this isn't the box for you. It is loud don't get me wrong, but for some who like super loud this won't do. This box give off rich quality sound. Crystal clear, perfect bass, and performs like a great sound bar. I connected my tablet and enjoyed a movie with this speaker. The box is made of mostly metal front, back, and top. The sides and bottom a nice light colored wood. It's designed for perfect sound, and that's exactly what you get. The connection to Bluetooth is easy, you can use an SD card, and auxiliary hook up as well. Charges with a type C USB charger wire. Charger box not included. What surprised me as well, there wasn't a remote to the box, considering the price of it. An amazing sounding box, 5 stars!","Reviewed in the United States February 29, 2024",AHHGJIR6Z37OS7DSS32WGAB7KY3Q,False,3,Color: Gold
R2175Z1F3RWMDA,B0CP7YLJ21,5.0 out of 5 stars Speaker,Veldatheresa,5,Studio quality sound! The bass sounds impeccable! This speaker literally enhance the sound of the television. I use the bluetooth settings for the television. Which is perfect because it wireless. I would not consider this to be a portable speaker simply because it’s heavy. Battery life is great quality as well! The best part of the speaker to me is the no static interference.,"Reviewed in the United States March 5, 2024",AEJU3Z6HDAERETMYI2CXBQVPPDFA,False,0,Color: Black
R3JO8WCN3AOUR3,B0CP7YLJ21,5.0 out of 5 stars What an amazing sounding speaker.,JAMES VANDERSCHAAF,5,The media could not be loaded. The speaker looks elegant and sounds awesome. I love it. I have it in my living room. Fills the whole room with awesome sound.,"Reviewed in the United States March 10, 2024",AGL4QCERHNPCLTHTCSBGQ4WROZXA,False,0,Color: Gray
R3VSPQWFC53BWQ,B0CP7YLJ21,"3.0 out of 5 stars Loud, bass heavy tabletop",E.Swope,3,"I should preference my review by saying that my personal preference is for balanced full range sound, and that I have distinct audiophile leanings. I have tried a number of Doss speakers over the past several years and have, by and large, thought pretty highly of them. Among upcoming brands which produce bass heavy/ extra bass speakers Doss is a standout. Their sound and build quality is generally better than comparably priced speaker in tat space.This speak IS loud, and it has a bass heavy profile even without the bass boost switched on. When I first turned it on the sound was rougher than I expected (knowing the brand) but after and hour or so of burn in it smoothed out quite a lot. Still, this is not what I would call a balanced profile. The pounding bass made REM sound like a dance (club) band. Things which leaned towards folk or jazz just did not sound right. The highs and mids are not so good, and the bass edge just does not work with some music. Again, I am talking about the basic profile with extra bass switched off..I should mention that in terms of features, this speaker has line in, an sd cards slot, and usb for use with flash drives. By contrast, other BT speakers in this price range, and comparably priced tabletop speakers I have tried, have wifi for streaming music. The speaker also lacks lossless blue tooth codecs, also found in speakers in this price range.While I was tempted to rate this 4 stars because of my prior experience with the band, I had my husband (a musician and audio engineer) listen to it and he shrugged and said ""just average"". This is the 4th tabletop I have tried this year. The others were from JBL, Marshall, and Klipsch. Fact is that all of them are better. Normally I would say that's not a fair comparison, but, given that the retail pricing on this speaker and the Klipsch are $20 apart, and that the Klipsch has a dynamic range of 20 hz to 22,000 khz, (This speaker is 35-25) there really is no comparison, except on price. I am not sure if that was the second or third speaker (or set of speakers) I have bought from Klipsch this year... to be honest I do not know what's going on but their speakers are a steal at the present time, while I think this particular Doss speaker is priced out of it's milieau.Others will undoubtedly like this speaker better than I do. If you are looking for something loud, with a bass heavy profile, you will like this speaker better than I. To my mind it performs like one of Doss's outdoor party speakers; only the shape is different.","Reviewed in the United States March 8, 2024",AGASAFHLQKQP7RNG76TKN4GPBJBQ,False,0,Color: Gold
